id,domain,original_prompt,enhanced_prompt,poas_score,clap_score,semantic_score,audio_file
834b3d30,music,A melancholic jazz piano trio in a dimly lit club,"High quality cinematic music, A melancholic jazz piano trio in a dimly lit club, rich stereo mix, grand piano, sustained pedal resonance, classical reverb tail, high fidelity audio, felt hammer strike transient, sympathetic string resonance, wide stereo spread, natural room acoustics, 88-key full range, swing rhythm, walking bass line, brushed snare, muted trumpet or saxophone lead, piano comping, warm room acoustics, intimate club atmosphere, improvised phrasing, natural dynamic variation",0.4454,0.4454,0.0,outputs/audio/music_834b3d30.wav
2f88df3f,music,Energetic techno loop with a driving 808 kick,"High quality cinematic music, Energetic techno loop with a driving 808 kick, rich stereo mix, 128–135 bpm, sidechain compression pumping, 808 kick drum, sub-bass frequencies, electronic dynamic range, minimal arrangement, industrial texture, four-on-the-floor pattern, reverb-drenched hi-hats, dark atmospheric pads",0.3586,0.3586,0.0,outputs/audio/music_2f88df3f.wav
5b24226a,music,Ambient synthesizer drone slowly evolving,"High quality cinematic music, Ambient synthesizer drone slowly evolving, rich stereo mix, electronic waveform synthesis, oscillator detuning, filter sweep cutoff resonance, LFO modulation, analog warmth or digital precision, pad or lead texture, stereo chorus, studio-quality output, slow evolving pad textures, long reverb tail 4–8 seconds, minimal rhythmic content, wide stereo field, sub-frequency drone, atmospheric shimmer, dynamic fade over time, immersive spatial depth",0.1243,0.1243,0.0,outputs/audio/music_5b24226a.wav
f23687b2,sfx,A heavy wooden door slamming shut in an empty hallway,"Realistic sound effect, clean isolated audio, A heavy wooden door slamming shut in an empty hallway, latch mechanism click, hinge creak, door mass thud on frame, room tone change on open or close, foley close-mic, dry or slight reverb",0.4665,0.4665,0.0,outputs/audio/sfx_f23687b2.wav
8a4802e2,sfx,A large explosion with debris and distant echo,"Realistic sound effect, clean isolated audio, A large explosion with debris and distant echo, low-frequency pressure wave sub-bass, mid-range shockwave crack, high-frequency debris scatter, long reverb tail in open space, dynamic peak then fade, cinematic layered design",0.4577,0.4577,0.0,outputs/audio/sfx_8a4802e2.wav
96953f18,sfx,Footsteps on gravel at a steady walking pace,"Realistic sound effect, clean isolated audio, Footsteps on gravel at a steady walking pace, rhythmic heel-toe impact, surface material variation (wood, concrete, gravel, carpet), room reverb or outdoor dry, dynamic weight and speed variation, foley close-mic recording",0.4761,0.4761,0.0,outputs/audio/sfx_96953f18.wav
ac5aaa34,ambient,A quiet forest at dawn with birds and a distant stream,"Immersive ambient soundscape, wide stereo atmosphere, natural environmental depth, realistic background ambience, A quiet forest at dawn with birds and a distant stream, layered birdsong canopy, wind through leaves, distant stream trickle, insect ambiance, low reverb natural space, binaural outdoor recording, natural dynamic variation, outdoor field recording, high-frequency trills and chirps, natural ambiance, wide stereo, multiple species layering, dawn chorus density, distance variation near to far, low background wind, no human-made noise",0.2604,0.2604,0.0,outputs/audio/ambient_ac5aaa34.wav
